{
 "$schema": "https://json-schema.org/draft/2020-12/schema",
 "$id": "https://exposure-atlas.invalid/schemas/domain/harness-capability-report.schema.json",
 "title": "HarnessCapabilityReport",
 "type": "object",
 "required": [
  "schema_version",
  "provider",
  "sdk_version",
  "qualified_at",
  "fixtures",
  "substitutions"
 ],
 "properties": {
  "schema_version": {
   "const": "atlas-harness-capability/v1"
  },
  "provider": {
   "const": "claude"
  },
  "sdk_version": {
   "type": "string",
   "minLength": 1
  },
  "qualified_at": {
   "type": "string",
   "pattern": "^\\d{4}-\\d{2}-\\d{2}T\\d{2}:\\d{2}:\\d{2}(\\.\\d+)?(Z|[+-]\\d{2}:\\d{2})$"
  },
  "fixtures": {
   "type": "array",
   "minItems": 1,
   "items": {
    "type": "object",
    "unevaluatedProperties": false,
    "required": [
     "fixture",
     "result"
    ],
    "properties": {
     "fixture": {
      "type": "string",
      "minLength": 1
     },
     "result": {
      "enum": [
       "pass",
       "fail",
       "not_applicable"
      ]
     },
     "detail": {
      "type": "string"
     }
    }
   }
  },
  "substitutions": {
   "type": "array",
   "items": {
    "type": "object",
    "unevaluatedProperties": false,
    "required": [
     "capability",
     "supplied_by",
     "adr"
    ],
    "properties": {
     "capability": {
      "type": "string",
      "minLength": 1
     },
     "supplied_by": {
      "type": "string",
      "minLength": 1
     },
     "adr": {
      "type": "string",
      "minLength": 1
     }
    }
   }
  }
 },
 "unevaluatedProperties": false
}
